{
  "$schema": "https://raw.githubusercontent.com/Jahrome907/web-quality-gatekeeper/v3/schemas/pr-risk-ledger.v1.json",
  "schemaVersion": "1.0.0",
  "generatedAt": "2026-05-11T22:00:00.000Z",
  "toolVersion": "3.2.4",
  "overallStatus": "pass",
  "mode": "single",
  "primaryUrl": "https://fixture.example/",
  "summaryPath": "summary.v2.json",
  "reportPath": "report.html",
  "riskCount": 0,
  "highestSeverity": "none",
  "entries": []
}
